<?xml version="1.0" encoding="UTF-8"?>
<rampage:RampageManifest xmlns:phptypes="http://www.linux-rampage.org/PHPTypes" xmlns:rampage="http://www.tux-rampage.org/ModuleManifest" xmlns:xsi="http://www.w3.org/2001/XMLSchema-instance" xsi:schemaLocation="http://www.tux-rampage.org/ModuleManifest ../../../../../xsd/rampage/core/ModuleManifest.xsd ">
    <module>
        <version>1.0.0</version>
        <label>Manifest Test</label>
    </module>
    
    <packages>
        <package>my.test.module</package>
        
        <aliases>
            <alias name="foo.Bar" class="my.foo.Bar" />
            <alias name="baz.SomeClass" class="custom.Rewrite" />
        </aliases>
    </packages>    
</rampage:RampageManifest>
